province,district,area_type,restricted_besi_sigir,restricted_sut_sigir,restricted_kucukbas,restricted_kanatli,restricted_etlik_tavuk,restricted_gezen_tavuk,restricted_hindi,restricted_kaz_ordek,restricted_hara_at,restricted_pet_lab,source_file,source_line,evidence_text,note
Amasya,,Dikili Tarım Arazileri;Marjinal Tarım Arazileri;Mutlak Tarım Arazileri;Özel Ürün Arazileri,,,,,,,,,,,100binlik/amasya.txt,,"6.14.1.12. Özel Ürün Arazileri: Bu alanlarda tarımsal amaçlı yapılar yapılabilir. Çiftçinin barınabileceği yapı emsale dahil olup İnşaat alanı 150 m2’yi geçemez, Tarımsal amaçlı yapılar için E(Emsal) = 0,05’dur. Bir parsel üzerinde müştemilat ve tarımsal amaçlı yapılar hariç birden fazla yapı yapılamaz. Müştemilat binaları inşaat alanına dâhildir. 6.14.1.10. Tarım arazileri sınıflaması, Gıda, Tarım ve Hayvancılık Bakanlığı'nca yapılacak/yaptırılacaktır. Tarımsal nitelikli alanlarda, belirlenmiş/ belirlenecek tarım arazileri sınıflamalarına göre tarımsal amaçlı yapılaşmalar aşağıda belirlenen koşullara göre gerçekleştirilecektir. 6.14.1.11. Mutlak Tarım Arazileri: Bu alanlarda; tarımsal amaçlı yapılar yapılabilir. Çiftçinin barınabileceği yapı emsale dahi olup, inşaat alanı 75 m2’yi geçemez. E(Emsal) = 0,10’dur. Bir parsel üzerinde müştemilat ve tarımsal amaçlı yapılar hariç birden fazla yapı yapılamaz. Müştemilat binaları inşaat alanına dâhildir. 6.14.1.12. Özel Ürün Arazileri: Bu alanlarda tarımsal amaçlı yapılar yapılabilir. Çiftçinin barınabileceği yapı emsale dahil olup İnşaat alanı 150 m2’yi geçemez, Tarımsal amaçlı yapılar için E(Emsal) = 0,05’dur. Bir parsel üzerinde müştemilat ve tarımsal amaçlı yapılar hariç birden fazla yapı yapılamaz. Müştemilat binaları inşaat alanına dâhildir. 6.14.1.13. Dikili Tarım Arazileri: Bu alanlarda; bu Planın Özel Ürün Arazileri için belirlenmiş yapılaşma koşulları geçerlidir. 6.14.1.14. Marjinal Tarım Arazileri: Marjinal tarım arazilerinde, tarımsal amaçlı yapılar yapılabilir. Tarımsal amaçlı yapılar için E(Emsal) = 0.30’dur. Çiftçinin barınabileceği yapının inşaat alanı 150 m2’yi geçemez. Bu yapılar, tarımsal amaçlı yapılar için belirlenmiş emsale dâhildir. Bir parsel üzerinde müştemilat ve tarımsal amaçlı yapılar hariç birden fazla yapı yapılamaz. Müştemilat binaları inşaat alanına dâhildir.",
Amasya,,Dikili Tarım Arazileri;Koruma/Koruma Alanları;Marjinal Tarım Arazileri;Mutlak Tarım Arazileri;Sulama Alanları;Örtü Altı Tarım (Seralar);Özel Ürün Arazileri,evet,evet,evet,evet,,,,,,,100binlik/amasya.txt,,"6.14.1.14. Marjinal Tarım Arazileri: Marjinal tarım arazilerinde, tarımsal amaçlı yapılar yapılabilir. Tarımsal amaçlı yapılar için E(Emsal) = 0.30’dur. Çiftçinin barınabileceği yapının inşaat alanı 150 m2’yi geçemez. Bu yapılar, tarımsal amaçlı yapılar için belirlenmiş emsale dâhildir. Bir parsel üzerinde müştemilat ve tarımsal amaçlı yapılar hariç birden fazla yapı yapılamaz. Müştemilat binaları inşaat alanına dâhildir. 6.14.1.12. Özel Ürün Arazileri: Bu alanlarda tarımsal amaçlı yapılar yapılabilir. Çiftçinin barınabileceği yapı emsale dahil olup İnşaat alanı 150 m2’yi geçemez, Tarımsal amaçlı yapılar için E(Emsal) = 0,05’dur. Bir parsel üzerinde müştemilat ve tarımsal amaçlı yapılar hariç birden fazla yapı yapılamaz. Müştemilat binaları inşaat alanına dâhildir. 6.14.1.13. Dikili Tarım Arazileri: Bu alanlarda; bu Planın Özel Ürün Arazileri için belirlenmiş yapılaşma koşulları geçerlidir. 6.14.1.14. Marjinal Tarım Arazileri: Marjinal tarım arazilerinde, tarımsal amaçlı yapılar yapılabilir. Tarımsal amaçlı yapılar için E(Emsal) = 0.30’dur. Çiftçinin barınabileceği yapının inşaat alanı 150 m2’yi geçemez. Bu yapılar, tarımsal amaçlı yapılar için belirlenmiş emsale dâhildir. Bir parsel üzerinde müştemilat ve tarımsal amaçlı yapılar hariç birden fazla yapı yapılamaz. Müştemilat binaları inşaat alanına dâhildir. 6.14.1.15. 5403 sayılı Toprak Koruma ve Arazi Kullanım Kanunu kapsamındaki tarım arazilerinde, T.C. Tarım ve Orman Bakanlığı, ilgili bakanlıklar ve bunların bağlı kuruluşları tarafından desteklenen projeye dayalı tarımsal faaliyetler kapsamında tarımsal amaçlı yapılar (tarımsal kalkınma kooperatiflerince uygulanan projeler, üretici birlikleri/kooperatifleri tarafından uygulanan projeler, Avrupa Birliği kaynaklı projeler, Dünya Bankası destekli projeler, sosyal riski azaltma projesi kapsamında uygulanacak projeler gibi) ile destekleme projeleri, en az 100 büyükbaş, 200 küçükbaş ve üzeri kapasiteli hayvancılık veya 50.000 adet ve üzeri kapasiteli kanatlı hayvancılık yatırımları ile hastalıktan ari işletme sertifikasına sahip işletmelerin yatırımlarında ve işletme projesi olup İl/İlçe Tarım ve Orman Müdürlüğüne, hastalıktan ari işletme sertifikası için dilekçe ile birlikte arilik sertifikası alacağına dair taahhütname veren yeni işletme yatırımlarında (fiilen sulanan ya da sulama projesi kapsamında bulunan tarım arazileri, dikili tarım arazileri ve özel ürün arazileri haricinde) mutlak ve marjinal tarım arazileri için belirtilen yapılaşma emsali %50 oranında artırılabilir. 6.14.1.16. Tarım arazilerinde örtü altı tarım yapılması durumunda seralar emsale dâhil değildir.",
Amasya,,Dikili Tarım Arazileri;Koruma/Koruma Alanları;Marjinal Tarım Arazileri;Mutlak Tarım Arazileri;Sulama Alanları;Örtü Altı Tarım (Seralar);Özel Ürün Arazileri,evet,evet,evet,evet,,,,,,,100binlik/amasya.txt,,"6.14.1.15. 5403 sayılı Toprak Koruma ve Arazi Kullanım Kanunu kapsamındaki tarım arazilerinde, T.C. Tarım ve Orman Bakanlığı, ilgili bakanlıklar ve bunların bağlı kuruluşları tarafından desteklenen projeye dayalı tarımsal faaliyetler kapsamında tarımsal amaçlı yapılar (tarımsal kalkınma kooperatiflerince uygulanan projeler, üretici birlikleri/kooperatifleri tarafından uygulanan projeler, Avrupa Birliği kaynaklı projeler, Dünya Bankası destekli projeler, sosyal riski azaltma projesi kapsamında uygulanacak projeler gibi) ile destekleme projeleri, en az 100 büyükbaş, 200 küçükbaş ve üzeri kapasiteli hayvancılık veya 50.000 adet ve üzeri kapasiteli kanatlı hayvancılık yatırımları ile hastalıktan ari işletme sertifikasına sahip işletmelerin yatırımlarında ve işletme projesi olup İl/İlçe Tarım ve Orman Müdürlüğüne, hastalıktan ari işletme sertifikası için dilekçe ile birlikte arilik sertifikası alacağına dair taahhütname veren yeni işletme yatırımlarında (fiilen sulanan ya da sulama projesi kapsamında bulunan tarım arazileri, dikili tarım arazileri ve özel ürün arazileri haricinde) mutlak ve marjinal tarım arazileri için belirtilen yapılaşma emsali %50 oranında artırılabilir. 6.14.1.13. Dikili Tarım Arazileri: Bu alanlarda; bu Planın Özel Ürün Arazileri için belirlenmiş yapılaşma koşulları geçerlidir. 6.14.1.14. Marjinal Tarım Arazileri: Marjinal tarım arazilerinde, tarımsal amaçlı yapılar yapılabilir. Tarımsal amaçlı yapılar için E(Emsal) = 0.30’dur. Çiftçinin barınabileceği yapının inşaat alanı 150 m2’yi geçemez. Bu yapılar, tarımsal amaçlı yapılar için belirlenmiş emsale dâhildir. Bir parsel üzerinde müştemilat ve tarımsal amaçlı yapılar hariç birden fazla yapı yapılamaz. Müştemilat binaları inşaat alanına dâhildir. 6.14.1.15. 5403 sayılı Toprak Koruma ve Arazi Kullanım Kanunu kapsamındaki tarım arazilerinde, T.C. Tarım ve Orman Bakanlığı, ilgili bakanlıklar ve bunların bağlı kuruluşları tarafından desteklenen projeye dayalı tarımsal faaliyetler kapsamında tarımsal amaçlı yapılar (tarımsal kalkınma kooperatiflerince uygulanan projeler, üretici birlikleri/kooperatifleri tarafından uygulanan projeler, Avrupa Birliği kaynaklı projeler, Dünya Bankası destekli projeler, sosyal riski azaltma projesi kapsamında uygulanacak projeler gibi) ile destekleme projeleri, en az 100 büyükbaş, 200 küçükbaş ve üzeri kapasiteli hayvancılık veya 50.000 adet ve üzeri kapasiteli kanatlı hayvancılık yatırımları ile hastalıktan ari işletme sertifikasına sahip işletmelerin yatırımlarında ve işletme projesi olup İl/İlçe Tarım ve Orman Müdürlüğüne, hastalıktan ari işletme sertifikası için dilekçe ile birlikte arilik sertifikası alacağına dair taahhütname veren yeni işletme yatırımlarında (fiilen sulanan ya da sulama projesi kapsamında bulunan tarım arazileri, dikili tarım arazileri ve özel ürün arazileri haricinde) mutlak ve marjinal tarım arazileri için belirtilen yapılaşma emsali %50 oranında artırılabilir. 6.14.1.16. Tarım arazilerinde örtü altı tarım yapılması durumunda seralar emsale dâhil değildir. 6.14.1.17. Bu planda tarım arazisi olarak gösterilmiş alanlarda mera vasıflı alanlar bulunması durumunda, bu alanlarda Çayır ve Mera Alanlarına ilişkin plan hükümleri doğrultusunda uygulama yapılır.",
Amasya,,Örtü Altı Tarım (Seralar);Özel Ürün Arazileri,,,,,,,,,,,100binlik/amasya.txt,,"6.14.1.18. Tarımsal faaliyetin gerektirdiği (hayvancılık, seracılık, vb.) ve çiftçinin barınması amaçlı yapı haricinde tarımsal faaliyetten bağımsız barınma amaçlı yapı yapılamaz. 6.14.1.16. Tarım arazilerinde örtü altı tarım yapılması durumunda seralar emsale dâhil değildir. 6.14.1.17. Bu planda tarım arazisi olarak gösterilmiş alanlarda mera vasıflı alanlar bulunması durumunda, bu alanlarda Çayır ve Mera Alanlarına ilişkin plan hükümleri doğrultusunda uygulama yapılır. 6.14.1.18. Tarımsal faaliyetin gerektirdiği (hayvancılık, seracılık, vb.) ve çiftçinin barınması amaçlı yapı haricinde tarımsal faaliyetten bağımsız barınma amaçlı yapı yapılamaz. 6.14.1.19. Silo, samanlık, yem deposu vb. yapıların yükseklikleri (Y.ençok) ihtiyaç doğrultusunda Gıda, Tarım ve Hayvancılık İl Müdürlüğü’nün uygun görüşü alınarak belirlenir. 6.14.1.20. Gıda, Tarım ve Hayvancılık Bakanlığınca ova sınırlarının tespit edilmesinin ardından ova sınırları içerisinde kaldığı tespit edilen alanlarda özel ürün arazilerine ilişkin hükümler uygulanacaktır. Bu alanlarda tarım ve hayvancılık geliştirme alanları yapılamaz.",
Amasya,,Özel Ürün Arazileri,,,,,,,,,,,100binlik/amasya.txt,,"6.14.1.19. Silo, samanlık, yem deposu vb. yapıların yükseklikleri (Y.ençok) ihtiyaç doğrultusunda Gıda, Tarım ve Hayvancılık İl Müdürlüğü’nün uygun görüşü alınarak belirlenir. 6.14.1.17. Bu planda tarım arazisi olarak gösterilmiş alanlarda mera vasıflı alanlar bulunması durumunda, bu alanlarda Çayır ve Mera Alanlarına ilişkin plan hükümleri doğrultusunda uygulama yapılır. 6.14.1.18. Tarımsal faaliyetin gerektirdiği (hayvancılık, seracılık, vb.) ve çiftçinin barınması amaçlı yapı haricinde tarımsal faaliyetten bağımsız barınma amaçlı yapı yapılamaz. 6.14.1.19. Silo, samanlık, yem deposu vb. yapıların yükseklikleri (Y.ençok) ihtiyaç doğrultusunda Gıda, Tarım ve Hayvancılık İl Müdürlüğü’nün uygun görüşü alınarak belirlenir. 6.14.1.20. Gıda, Tarım ve Hayvancılık Bakanlığınca ova sınırlarının tespit edilmesinin ardından ova sınırları içerisinde kaldığı tespit edilen alanlarda özel ürün arazilerine ilişkin hükümler uygulanacaktır. Bu alanlarda tarım ve hayvancılık geliştirme alanları yapılamaz.",
Amasya,,Sulama Alanları;Özel Ürün Arazileri,,,,,,,,,,,100binlik/amasya.txt,,"6.14.1.20. Gıda, Tarım ve Hayvancılık Bakanlığınca ova sınırlarının tespit edilmesinin ardından ova sınırları içerisinde kaldığı tespit edilen alanlarda özel ürün arazilerine ilişkin hükümler uygulanacaktır. Bu alanlarda tarım ve hayvancılık geliştirme alanları yapılamaz. 6.14.1.18. Tarımsal faaliyetin gerektirdiği (hayvancılık, seracılık, vb.) ve çiftçinin barınması amaçlı yapı haricinde tarımsal faaliyetten bağımsız barınma amaçlı yapı yapılamaz. 6.14.1.19. Silo, samanlık, yem deposu vb. yapıların yükseklikleri (Y.ençok) ihtiyaç doğrultusunda Gıda, Tarım ve Hayvancılık İl Müdürlüğü’nün uygun görüşü alınarak belirlenir. 6.14.1.20. Gıda, Tarım ve Hayvancılık Bakanlığınca ova sınırlarının tespit edilmesinin ardından ova sınırları içerisinde kaldığı tespit edilen alanlarda özel ürün arazilerine ilişkin hükümler uygulanacaktır. Bu alanlarda tarım ve hayvancılık geliştirme alanları yapılamaz.  6.14.2. 3083 Sayılı Sulama Alanlarında Arazi Düzenlemesine Dair Tarım Reformu Kanununa Tabi Araziler",
Amasya,,Sulama Alanları,,,,,,,,,,,100binlik/amasya.txt,,"6.14.2.2. Bu arazilerin tarımsal üretim amaçlı korunması esastır. Uygulama alanlarında, imar planları ve mücavir alanlar dışında kalan ve “Sulama Alanlarında Arazi Düzenlenmesine Dair Tarım Reformu Kanunu Uygulama Yönetmeliği” hükümlerine göre, sahibine bırakılan, dağıtılan veya T.C. Gıda, Tarım ve Hayvancılık Bakanlığı’nın tasarrufunda bulunan tarım arazisi, tarım dışı amaçla kullanılamaz. 6.14.2. 3083 Sayılı Sulama Alanlarında Arazi Düzenlemesine Dair Tarım Reformu Kanununa Tabi Araziler 6.14.2.1. Bu arazilerde yapılacak ifrazlarda 3083 sayılı Sulama Alanlarında Arazi Düzenlemesine Dair Tarım Reformu Kanunu ve ilgili yönetmelik hükümleri uyarınca işlem yapılacaktır. 6.14.2.2. Bu arazilerin tarımsal üretim amaçlı korunması esastır. Uygulama alanlarında, imar planları ve mücavir alanlar dışında kalan ve “Sulama Alanlarında Arazi Düzenlenmesine Dair Tarım Reformu Kanunu Uygulama Yönetmeliği” hükümlerine göre, sahibine bırakılan, dağıtılan veya T.C. Gıda, Tarım ve Hayvancılık Bakanlığı’nın tasarrufunda bulunan tarım arazisi, tarım dışı amaçla kullanılamaz. 6.14.2.3. Tarımsal faaliyetin gerektirdiği (hayvancılık, seracılık, vb.) ve çiftçinin barınması amaçlı yapı haricinde tarımsal faaliyetten bağımsız barınma amaçlı yapı yapılamaz. 6.14.2.4. Bu arazilerde; tarımsal amaçlı yapılar yapılabilir. Çiftçinin barınabileceği yapı emsale dâhil olup inşaat alanı 100 m2’yi geçemez. Tarımsal amaçlı yapılar için Maks. Emsal = 0,20’dir.",
Amasya,,Koruma/Koruma Alanları;Organize Tarım/Hayvancılık Alanları;Sulama Alanları,,,,,,,,,,,100binlik/amasya.txt,,"6.14.2.3. Tarımsal faaliyetin gerektirdiği (hayvancılık, seracılık, vb.) ve çiftçinin barınması amaçlı yapı haricinde tarımsal faaliyetten bağımsız barınma amaçlı yapı yapılamaz. 6.14.2.1. Bu arazilerde yapılacak ifrazlarda 3083 sayılı Sulama Alanlarında Arazi Düzenlemesine Dair Tarım Reformu Kanunu ve ilgili yönetmelik hükümleri uyarınca işlem yapılacaktır. 6.14.2.2. Bu arazilerin tarımsal üretim amaçlı korunması esastır. Uygulama alanlarında, imar planları ve mücavir alanlar dışında kalan ve “Sulama Alanlarında Arazi Düzenlenmesine Dair Tarım Reformu Kanunu Uygulama Yönetmeliği” hükümlerine göre, sahibine bırakılan, dağıtılan veya T.C. Gıda, Tarım ve Hayvancılık Bakanlığı’nın tasarrufunda bulunan tarım arazisi, tarım dışı amaçla kullanılamaz. 6.14.2.3. Tarımsal faaliyetin gerektirdiği (hayvancılık, seracılık, vb.) ve çiftçinin barınması amaçlı yapı haricinde tarımsal faaliyetten bağımsız barınma amaçlı yapı yapılamaz. 6.14.2.4. Bu arazilerde; tarımsal amaçlı yapılar yapılabilir. Çiftçinin barınabileceği yapı emsale dâhil olup inşaat alanı 100 m2’yi geçemez. Tarımsal amaçlı yapılar için Maks. Emsal = 0,20’dir. 6.14.2.5. 5403 sayılı Toprak Koruma ve Arazi Kullanımı Kanununda tanımlanan tarım arazilerinden fiilen sulanan veya sulama projesi kapsamında kalan tarım arazilerinde; bu planın, Organize Tarım ve Hayvancılık Alanları hükmü çerçevesinde ilgili idarelerce yapılacak olan uygulamalar haricinde öncelikle Gıda, Tarım ve Hayvancılık Bakanlığı ile Orman ve Su İşleri Bakanlığı’ndan ve ilgili diğer kurum ve kuruluşlardan uygun görüş alınması kaydıyla tarımsal amaçlı olduğu ilgili idaresince kabul edilen hayvancılık tesisleri yer alabilecek olup bu tesisler sonradan entegre tesise dönüştürülemez.",
Amasya,,Koruma/Koruma Alanları;Organize Tarım/Hayvancılık Alanları;Sulama Alanları,,,,,,,,,,,100binlik/amasya.txt,,"6.14.2.5. 5403 sayılı Toprak Koruma ve Arazi Kullanımı Kanununda tanımlanan tarım arazilerinden fiilen sulanan veya sulama projesi kapsamında kalan tarım arazilerinde; bu planın, Organize Tarım ve Hayvancılık Alanları hükmü çerçevesinde ilgili idarelerce yapılacak olan uygulamalar haricinde öncelikle Gıda, Tarım ve Hayvancılık Bakanlığı ile Orman ve Su İşleri Bakanlığı’ndan ve ilgili diğer kurum ve kuruluşlardan uygun görüş alınması kaydıyla tarımsal amaçlı olduğu ilgili idaresince kabul edilen hayvancılık tesisleri yer alabilecek olup bu tesisler sonradan entegre tesise dönüştürülemez. 6.14.2.3. Tarımsal faaliyetin gerektirdiği (hayvancılık, seracılık, vb.) ve çiftçinin barınması amaçlı yapı haricinde tarımsal faaliyetten bağımsız barınma amaçlı yapı yapılamaz. 6.14.2.4. Bu arazilerde; tarımsal amaçlı yapılar yapılabilir. Çiftçinin barınabileceği yapı emsale dâhil olup inşaat alanı 100 m2’yi geçemez. Tarımsal amaçlı yapılar için Maks. Emsal = 0,20’dir. 6.14.2.5. 5403 sayılı Toprak Koruma ve Arazi Kullanımı Kanununda tanımlanan tarım arazilerinden fiilen sulanan veya sulama projesi kapsamında kalan tarım arazilerinde; bu planın, Organize Tarım ve Hayvancılık Alanları hükmü çerçevesinde ilgili idarelerce yapılacak olan uygulamalar haricinde öncelikle Gıda, Tarım ve Hayvancılık Bakanlığı ile Orman ve Su İşleri Bakanlığı’ndan ve ilgili diğer kurum ve kuruluşlardan uygun görüş alınması kaydıyla tarımsal amaçlı olduğu ilgili idaresince kabul edilen hayvancılık tesisleri yer alabilecek olup bu tesisler sonradan entegre tesise dönüştürülemez. 6.14.2.6. 3083 sayılı Sulama Alanlarında Arazi Düzenlemesine Dair Tarım Reformu Kanunu kapsamı dışına çıkarılması durumunda, bu arazilerde, “5403 Sayılı Toprak Koruma ve Arazi Kullanımı Kanununa Tabi Araziler”e ilişkin plan hükümlerine uyulacaktır. 6.14.2.7. Bu arazilerde 5403 Sayılı Toprak Koruma ve Arazi Kullanımı Kanununa Tabi Arazilere ilişkin 6.14.1.15 numaralı plan hükümde belirtilen emsal artışı uygulaması yapılamaz.",
Amasya,,Koruma/Koruma Alanları;Organize Tarım/Hayvancılık Alanları;Sulama Alanları;Özel Ürün Arazileri,,,,,,,,,,,100binlik/amasya.txt,,"6.14.2.7. Bu arazilerde 5403 Sayılı Toprak Koruma ve Arazi Kullanımı Kanununa Tabi Arazilere ilişkin 6.14.1.15 numaralı plan hükümde belirtilen emsal artışı uygulaması yapılamaz. 6.14.2.5. 5403 sayılı Toprak Koruma ve Arazi Kullanımı Kanununda tanımlanan tarım arazilerinden fiilen sulanan veya sulama projesi kapsamında kalan tarım arazilerinde; bu planın, Organize Tarım ve Hayvancılık Alanları hükmü çerçevesinde ilgili idarelerce yapılacak olan uygulamalar haricinde öncelikle Gıda, Tarım ve Hayvancılık Bakanlığı ile Orman ve Su İşleri Bakanlığı’ndan ve ilgili diğer kurum ve kuruluşlardan uygun görüş alınması kaydıyla tarımsal amaçlı olduğu ilgili idaresince kabul edilen hayvancılık tesisleri yer alabilecek olup bu tesisler sonradan entegre tesise dönüştürülemez. 6.14.2.6. 3083 sayılı Sulama Alanlarında Arazi Düzenlemesine Dair Tarım Reformu Kanunu kapsamı dışına çıkarılması durumunda, bu arazilerde, “5403 Sayılı Toprak Koruma ve Arazi Kullanımı Kanununa Tabi Araziler”e ilişkin plan hükümlerine uyulacaktır. 6.14.2.7. Bu arazilerde 5403 Sayılı Toprak Koruma ve Arazi Kullanımı Kanununa Tabi Arazilere ilişkin 6.14.1.15 numaralı plan hükümde belirtilen emsal artışı uygulaması yapılamaz. 6.14.2.8. Silo, samanlık, yem deposu vb. yapıların yükseklikleri (Y.ençok) ihtiyaç doğrultusunda İl Gıda, Tarım ve Hayvancılık İl Müdürlüğü’nün uygun görüşü alınarak belirlenir. 6.14.2.9. Gıda, Tarım ve Hayvancılık Bakanlığınca ova sınırlarının tespit edilmesinin ardından ova sınırları içerisinde kaldığı tespit edilen alanlarda özel ürün arazilerine ilişkin plan hükmü uygulanacaktır. Bu alanlarda tarım ve hayvancılık geliştirme alanları yapılamaz.",
Amasya,,Koruma/Koruma Alanları;Sulama Alanları;Özel Ürün Arazileri,,,,,,,,,,,100binlik/amasya.txt,,"6.14.2.8. Silo, samanlık, yem deposu vb. yapıların yükseklikleri (Y.ençok) ihtiyaç doğrultusunda İl Gıda, Tarım ve Hayvancılık İl Müdürlüğü’nün uygun görüşü alınarak belirlenir. 6.14.2.6. 3083 sayılı Sulama Alanlarında Arazi Düzenlemesine Dair Tarım Reformu Kanunu kapsamı dışına çıkarılması durumunda, bu arazilerde, “5403 Sayılı Toprak Koruma ve Arazi Kullanımı Kanununa Tabi Araziler”e ilişkin plan hükümlerine uyulacaktır. 6.14.2.7. Bu arazilerde 5403 Sayılı Toprak Koruma ve Arazi Kullanımı Kanununa Tabi Arazilere ilişkin 6.14.1.15 numaralı plan hükümde belirtilen emsal artışı uygulaması yapılamaz. 6.14.2.8. Silo, samanlık, yem deposu vb. yapıların yükseklikleri (Y.ençok) ihtiyaç doğrultusunda İl Gıda, Tarım ve Hayvancılık İl Müdürlüğü’nün uygun görüşü alınarak belirlenir. 6.14.2.9. Gıda, Tarım ve Hayvancılık Bakanlığınca ova sınırlarının tespit edilmesinin ardından ova sınırları içerisinde kaldığı tespit edilen alanlarda özel ürün arazilerine ilişkin plan hükmü uygulanacaktır. Bu alanlarda tarım ve hayvancılık geliştirme alanları yapılamaz.",
Amasya,,Koruma/Koruma Alanları;Özel Ürün Arazileri,,,,,,,,,,,100binlik/amasya.txt,,"6.14.2.9. Gıda, Tarım ve Hayvancılık Bakanlığınca ova sınırlarının tespit edilmesinin ardından ova sınırları içerisinde kaldığı tespit edilen alanlarda özel ürün arazilerine ilişkin plan hükmü uygulanacaktır. Bu alanlarda tarım ve hayvancılık geliştirme alanları yapılamaz. 6.14.2.7. Bu arazilerde 5403 Sayılı Toprak Koruma ve Arazi Kullanımı Kanununa Tabi Arazilere ilişkin 6.14.1.15 numaralı plan hükümde belirtilen emsal artışı uygulaması yapılamaz. 6.14.2.8. Silo, samanlık, yem deposu vb. yapıların yükseklikleri (Y.ençok) ihtiyaç doğrultusunda İl Gıda, Tarım ve Hayvancılık İl Müdürlüğü’nün uygun görüşü alınarak belirlenir. 6.14.2.9. Gıda, Tarım ve Hayvancılık Bakanlığınca ova sınırlarının tespit edilmesinin ardından ova sınırları içerisinde kaldığı tespit edilen alanlarda özel ürün arazilerine ilişkin plan hükmü uygulanacaktır. Bu alanlarda tarım ve hayvancılık geliştirme alanları yapılamaz.  6.21. Çayır ve Meralar",
Antalya,burdur,Koruma/Koruma Alanları;Organize Tarım/Hayvancılık Alanları;Sulama Alanları,,,,,,,,,,,100binlik/antalya-burdur-ısparta.txt,,"5403 sayılı Toprak Koruma Ve Arazi Kullanımı Kanununda tanımlanan tarım arazilerinden fiilen sulanan veya sulama projesi kapsamında kalan tarım arazilerinde; bu planın, 9.39 Organize Tarım ve Hayvancılık Alanı hükmü çerçevesinde ilgili idarelerce yapılacak olan uygulamalar haricinde öncelikle Gıda, Tarım ve Hayvancılık Bakanlığı ile Orman ve Su İşleri Bakanlığı’ndan ve ilgili diğer kurum ve kuruluşlardan uygun görüş alınması kaydıyla tarımsal amaçlı yapılar yapılabilir. Çiftçinin barınabileceği yapı emsale dahil olup inşaat alanı 75 m2’yi geçemez. Bu alanlarda Tarımsal amaçlı yapılar için maks. Emsal = 0,20 olup Tarımsal Amaçlı Entegre Yapılara izin verilmez. Tarımsal amaçlı yapılar kullanım amacı dışında kullanılamaz ve dönüştürülemez. Tarım alanlarında yapılacak tarımsal amaçlı yapılarda bu plan ile verilmiş olan yapılanma koşulları aşılmamak kaydıyla, 3194 sayılı İmar Kanunu “Plansız Alanlar Yönetmeliği”nin 6. Bölümünde belirtilen esaslara uyulur. 5403 sayılı Toprak Koruma Ve Arazi Kullanımı Kanununda tanımlanan tarım arazilerinden fiilen sulanan veya sulama projesi kapsamında kalan tarım arazilerinde; bu planın, 9.39 Organize Tarım ve Hayvancılık Alanı hükmü çerçevesinde ilgili idarelerce yapılacak olan uygulamalar haricinde öncelikle Gıda, Tarım ve Hayvancılık Bakanlığı ile Orman ve Su İşleri Bakanlığı’ndan ve ilgili diğer kurum ve kuruluşlardan uygun görüş alınması kaydıyla tarımsal amaçlı yapılar yapılabilir. Çiftçinin barınabileceği yapı emsale dahil olup inşaat alanı 75 m2’yi geçemez. Bu alanlarda Tarımsal amaçlı yapılar için maks. Emsal = 0,20 olup Tarımsal Amaçlı Entegre Yapılara izin verilmez. Tarım arazilerinde tarımsal faaliyetin gerektirdiği (hayvancılık, seracılık vb.) çiftçinin barınabileceği yapı haricinde barınma amaçlı yapı yapılamaz. Tarım arazilerinde 9.39 no’lu plan hükmü kapsamında “Organize Tarım ve Hayvancılık Alanı” alanları belirlenebilir.",
