province,district,area_type,restricted_besi_sigir,restricted_sut_sigir,restricted_kucukbas,restricted_kanatli,restricted_etlik_tavuk,restricted_gezen_tavuk,restricted_hindi,restricted_kaz_ordek,restricted_hara_at,restricted_pet_lab,source_file,source_line,evidence_text,note
Mersin,adana,Koruma/Koruma Alanları,,,,,,,,,,,webimar-nextjs/data/100binlik/mersin-adana.txt,,"8.25.1.8. Tarımsal amaçlı faaliyetin gerektirdiği (hayvancılık, seracılık gibi) çiftçinin barınabileceği yapılar ve müştemilatları dışında, tarım alanlarında barınma amaçlı yapılara izin verilmez. 8.25.1.6. Tarım alanlarında yapılacak tarımsal amaçlı yapılar için bu plan ile verilmiş olan yapılanma koşulları aşılamaz. Maksimum bina yüksekliği ihtiyaç doğrultusunda Tarım ve Orman Bakanlığı/Tarım ve Orman İl Müdürlüğü tarafından projesine uygun olarak belirlenecektir.  8.25.1.8. Tarımsal amaçlı faaliyetin gerektirdiği (hayvancılık, seracılık gibi) çiftçinin barınabileceği yapılar ve müştemilatları dışında, tarım alanlarında barınma amaçlı yapılara izin verilmez.  8.25.1.9. İçme ve kullanma suyu temin edilen kıta içi yüzeysel su kaynaklarının bulunduğu havzalarda, kısa mesafeli koruma kuşaklarında yapılan tarımsal faaliyetlerde, organik tarım özendirilecektir.",
Mersin,adana,Sulama Alanları,,,,,,,,,,,webimar-nextjs/data/100binlik/mersin-adana.txt,,"8.25.2.2. Bu arazilerin tarımsal üretim amaçlı korunması esastır. Uygulama alanlarında... T.C. Gıda, Tarım ve Hayvancılık Bakanlığı’nın emrine geçen tarım arazileri, tarım dışı amaçla kullanılamaz. 8.25.2. 3083 Sayılı Sulama Alanlarında Arazi Düzenlemesine Dair Tarım Reformu Kanunu’na Tabi Araziler 8.25.2.2. Bu arazilerin tarımsal üretim amaçlı korunması esastır. Uygulama alanlarında... T.C. Gıda, Tarım ve Hayvancılık Bakanlığı’nın emrine geçen tarım arazileri, tarım dışı amaçla kullanılamaz. 8.25.2.3. Bu arazilerde; tarımsal amaçlı yapı ile çiftçinin barınabileceği yapı ve müştemilatları dışında yapı yapılamaz. Çiftçinin barınabileceği yapı emsale dahil olup inşaat alanı 75 m²’yi geçemez. Emsal: 0,20’dir. 8.25.2.4. Tarımsal faaliyetin gerektirdiği çiftçinin barınabileceği yapı haricinde barınma amaçlı yapı yapılamaz.",
Mersin,adana,Sulama Alanları,,,,,,,,,,,webimar-nextjs/data/100binlik/mersin-adana.txt,,"8.25.2.3. Bu arazilerde; tarımsal amaçlı yapı ile çiftçinin barınabileceği yapı ve müştemilatları dışında yapı yapılamaz. Çiftçinin barınabileceği yapı emsale dahil olup inşaat alanı 75 m²’yi geçemez. Emsal: 0,20’dir. 8.25.2. 3083 Sayılı Sulama Alanlarında Arazi Düzenlemesine Dair Tarım Reformu Kanunu’na Tabi Araziler 8.25.2.2. Bu arazilerin tarımsal üretim amaçlı korunması esastır. Uygulama alanlarında... T.C. Gıda, Tarım ve Hayvancılık Bakanlığı’nın emrine geçen tarım arazileri, tarım dışı amaçla kullanılamaz. 8.25.2.3. Bu arazilerde; tarımsal amaçlı yapı ile çiftçinin barınabileceği yapı ve müştemilatları dışında yapı yapılamaz. Çiftçinin barınabileceği yapı emsale dahil olup inşaat alanı 75 m²’yi geçemez. Emsal: 0,20’dir. 8.25.2.4. Tarımsal faaliyetin gerektirdiği çiftçinin barınabileceği yapı haricinde barınma amaçlı yapı yapılamaz. 8.25.2.5. 3083 sayılı “Sulama Alanlarında Arazi Düzenlemesine Dair Tarım Reformu Kanunu” kapsamı dışına çıkarılması durumunda, bu arazilerde, “8.25.1.” nolu plan hükümlerine uyulacaktır.",
Mersin,adana,Sulama Alanları,,,,,,,,,,,webimar-nextjs/data/100binlik/mersin-adana.txt,,"8.25.2.4. Tarımsal faaliyetin gerektirdiği çiftçinin barınabileceği yapı haricinde barınma amaçlı yapı yapılamaz. 8.25.2.2. Bu arazilerin tarımsal üretim amaçlı korunması esastır. Uygulama alanlarında... T.C. Gıda, Tarım ve Hayvancılık Bakanlığı’nın emrine geçen tarım arazileri, tarım dışı amaçla kullanılamaz. 8.25.2.3. Bu arazilerde; tarımsal amaçlı yapı ile çiftçinin barınabileceği yapı ve müştemilatları dışında yapı yapılamaz. Çiftçinin barınabileceği yapı emsale dahil olup inşaat alanı 75 m²’yi geçemez. Emsal: 0,20’dir. 8.25.2.4. Tarımsal faaliyetin gerektirdiği çiftçinin barınabileceği yapı haricinde barınma amaçlı yapı yapılamaz. 8.25.2.5. 3083 sayılı “Sulama Alanlarında Arazi Düzenlemesine Dair Tarım Reformu Kanunu” kapsamı dışına çıkarılması durumunda, bu arazilerde, “8.25.1.” nolu plan hükümlerine uyulacaktır.",
Konya,karaman,Sulama Alanları,,,,,,,,,,,webimar-nextjs/data/100binlik/konya-karaman.txt,,"2. Bu alanların tarımsal üretim amaçlı korunması esastır. Uygulama alanlarında imar planları ve mücavir alanlar dışında kalan ve Sulama Alanlarında Arazi Düzenlenmesine Dair Tarım Reformu Kanunu Uygulama Yönetmeliği hükümlerine göre sahibine bırakılan, dağıtılan veya Gıda Tarım ve Hayvancılık Bakanlığı’nın emrine geçen tarım alanı, tarım dışı amaçla kullanılamaz. 8.2.2.3.2. 3083 Sayılı Sulama Alanlarında Arazi Düzenlemesine Dair Tarım Reformu Kanununa Tabi Tarım Alanı 1. Bu alanlarda yapılacak ifrazlarda 3083 sayılı Sulama Alanlarında Arazi Düzenlemesine Dair Tarım Reformu Kanunu ve ilgili yönetmelik hükümleri uyarınca işlem yapılacaktır. 2. Bu alanların tarımsal üretim amaçlı korunması esastır. Uygulama alanlarında imar planları ve mücavir alanlar dışında kalan ve Sulama Alanlarında Arazi Düzenlenmesine Dair Tarım Reformu Kanunu Uygulama Yönetmeliği hükümlerine göre sahibine bırakılan, dağıtılan veya Gıda Tarım ve Hayvancılık Bakanlığı’nın emrine geçen tarım alanı, tarım dışı amaçla kullanılamaz. 3. Bu alanlarda tarımsal amaçlı yapı ile çiftçinin barınabileceği yapı ve müştemilatları dışında yapı yapılamaz. Çiftçinin barınabileceği yapı emsale dahil olup toplam inşaat alanı 75 m2’yi geçemez. Tarımsal amaçlı yapılar için Maks. Emsal=0,20’dir. 4. Bu plan ile verilmiş olan yapılanma koşulları aşılmamak kaydıyla tarım alanlarında yapılacak tarımsal amaçlı yapılar için yükseklik Gıda Tarım ve Hayvancılık Bakanlığı tarafından projesine uygun olarak belirlenecek olup bu planda yer almayan hususlarda 3194 sayılı İmar Kanunu Plansız Alanlar Yönetmeliği'nin 6. Bölümünde belirtilen esaslara uyulur.",
Konya,karaman,Sulama Alanları,,,,,,,,,,,webimar-nextjs/data/100binlik/konya-karaman.txt,,"3. Bu alanlarda tarımsal amaçlı yapı ile çiftçinin barınabileceği yapı ve müştemilatları dışında yapı yapılamaz. Çiftçinin barınabileceği yapı emsale dahil olup toplam inşaat alanı 75 m2’yi geçemez. Tarımsal amaçlı yapılar için Maks. Emsal=0,20’dir. 1. Bu alanlarda yapılacak ifrazlarda 3083 sayılı Sulama Alanlarında Arazi Düzenlemesine Dair Tarım Reformu Kanunu ve ilgili yönetmelik hükümleri uyarınca işlem yapılacaktır. 2. Bu alanların tarımsal üretim amaçlı korunması esastır. Uygulama alanlarında imar planları ve mücavir alanlar dışında kalan ve Sulama Alanlarında Arazi Düzenlenmesine Dair Tarım Reformu Kanunu Uygulama Yönetmeliği hükümlerine göre sahibine bırakılan, dağıtılan veya Gıda Tarım ve Hayvancılık Bakanlığı’nın emrine geçen tarım alanı, tarım dışı amaçla kullanılamaz. 3. Bu alanlarda tarımsal amaçlı yapı ile çiftçinin barınabileceği yapı ve müştemilatları dışında yapı yapılamaz. Çiftçinin barınabileceği yapı emsale dahil olup toplam inşaat alanı 75 m2’yi geçemez. Tarımsal amaçlı yapılar için Maks. Emsal=0,20’dir. 4. Bu plan ile verilmiş olan yapılanma koşulları aşılmamak kaydıyla tarım alanlarında yapılacak tarımsal amaçlı yapılar için yükseklik Gıda Tarım ve Hayvancılık Bakanlığı tarafından projesine uygun olarak belirlenecek olup bu planda yer almayan hususlarda 3194 sayılı İmar Kanunu Plansız Alanlar Yönetmeliği'nin 6. Bölümünde belirtilen esaslara uyulur. 5. 3083 sayılı Sulama Alanlarında Arazi Düzenlemesine Dair Tarım Reformu Kanunu kapsamı dışına çıkarılması durumunda, bu alanlarda Tarım Alanı plan hükümlerine uyulacaktır.",
Konya,karaman,Sulama Alanları,,,,,,,,,,,webimar-nextjs/data/100binlik/konya-karaman.txt,,"4. Bu plan ile verilmiş olan yapılanma koşulları aşılmamak kaydıyla tarım alanlarında yapılacak tarımsal amaçlı yapılar için yükseklik Gıda Tarım ve Hayvancılık Bakanlığı tarafından projesine uygun olarak belirlenecek olup bu planda yer almayan hususlarda 3194 sayılı İmar Kanunu Plansız Alanlar Yönetmeliği'nin 6. Bölümünde belirtilen esaslara uyulur. 2. Bu alanların tarımsal üretim amaçlı korunması esastır. Uygulama alanlarında imar planları ve mücavir alanlar dışında kalan ve Sulama Alanlarında Arazi Düzenlenmesine Dair Tarım Reformu Kanunu Uygulama Yönetmeliği hükümlerine göre sahibine bırakılan, dağıtılan veya Gıda Tarım ve Hayvancılık Bakanlığı’nın emrine geçen tarım alanı, tarım dışı amaçla kullanılamaz. 3. Bu alanlarda tarımsal amaçlı yapı ile çiftçinin barınabileceği yapı ve müştemilatları dışında yapı yapılamaz. Çiftçinin barınabileceği yapı emsale dahil olup toplam inşaat alanı 75 m2’yi geçemez. Tarımsal amaçlı yapılar için Maks. Emsal=0,20’dir. 4. Bu plan ile verilmiş olan yapılanma koşulları aşılmamak kaydıyla tarım alanlarında yapılacak tarımsal amaçlı yapılar için yükseklik Gıda Tarım ve Hayvancılık Bakanlığı tarafından projesine uygun olarak belirlenecek olup bu planda yer almayan hususlarda 3194 sayılı İmar Kanunu Plansız Alanlar Yönetmeliği'nin 6. Bölümünde belirtilen esaslara uyulur. 5. 3083 sayılı Sulama Alanlarında Arazi Düzenlemesine Dair Tarım Reformu Kanunu kapsamı dışına çıkarılması durumunda, bu alanlarda Tarım Alanı plan hükümlerine uyulacaktır.",
Çorum,samsun,Dikili Tarım Arazileri;Marjinal Tarım Arazileri;Sulama Alanları;Özel Ürün Arazileri,,,,,,,,,,,webimar-nextjs/data/100binlik/çorum-samsun-tokat.txt,,"Bir parsel üzerinde müştemilat ve tarımsal amaçlı yapılar hariç birden fazla yapı yapılamaz. Müştemilat binaları inşaat alanına dahildir. 1.5.17.1.11.3 Dikili Tarım Arazileri: Bu alanlarda; “1.5.17.1.11.2 Özel Ürün Arazileri” hükmünde yer alan koşullar geçerlidir. 1.5.17.1.11.4 Marjinal Tarım Arazileri: Marjinal tarım arazilerinde, tarımsal amaçlı yapılar yapılabilir. Tarımsal amaçlı yapılar için E(Emsal) = 0.30’dur. Çiftçinin barınabileceği yapının inşaat alanı 150 m2’yi geçemez. Bu yapılar, tarımsal amaçlı yapılar için belirlenmiş emsale dahildir. Bir parsel üzerinde müştemilat ve tarımsal amaçlı yapılar hariç birden fazla yapı yapılamaz. Müştemilat binaları inşaat alanına dahildir. 1.5.17.1.12 Dünya Bankası, Avrupa Birliği Fonları, Tarım ve Kırsal Kalkınmayı Destekleme Kurumu ve Gıda, Tarım ve Hayvancılık Bakanlığı tarafından desteklenen tarımsal ve hayvancılık amaçlı projeler... ile hastalıktan ari işletme sertifikasına sahip işletmelerin yatırımlarında ve işletme projesi olup İl/İlçe Tarım ve Orman Müdürlüğüne, hastalıktan ari işletme sertifikası için dilekçe ile birlikte arilik sertifikası alacağına dair taahhütname veren yeni işletme yatırımlarında yapılaşma emsali %50 oranında artırılabilir. Ancak fiilen sulanan ve/veya sulama projesi kapsamında kalan tarım arazilerinde bu hüküm uygulanmaz. Tarımsal amaçlı yapılar amacı dışında kullanılamaz ve başka bir kullanıma dönüştürülemez.",
Çorum,samsun,Marjinal Tarım Arazileri;Sulama Alanları;Örtü Altı Tarım (Seralar),,,,,,,,,,,webimar-nextjs/data/100binlik/çorum-samsun-tokat.txt,,"1.5.17.1.12 Dünya Bankası, Avrupa Birliği Fonları, Tarım ve Kırsal Kalkınmayı Destekleme Kurumu ve Gıda, Tarım ve Hayvancılık Bakanlığı tarafından desteklenen tarımsal ve hayvancılık amaçlı projeler... ile hastalıktan ari işletme sertifikasına sahip işletmelerin yatırımlarında ve işletme projesi olup İl/İlçe Tarım ve Orman Müdürlüğüne, hastalıktan ari işletme sertifikası için dilekçe ile birlikte arilik sertifikası alacağına dair taahhütname veren yeni işletme yatırımlarında yapılaşma emsali %50 oranında artırılabilir. 1.5.17.1.11.4 Marjinal Tarım Arazileri: Marjinal tarım arazilerinde, tarımsal amaçlı yapılar yapılabilir. Tarımsal amaçlı yapılar için E(Emsal) = 0.30’dur. Çiftçinin barınabileceği yapının inşaat alanı 150 m2’yi geçemez. Bu yapılar, tarımsal amaçlı yapılar için belirlenmiş emsale dahildir. Bir parsel üzerinde müştemilat ve tarımsal amaçlı yapılar hariç birden fazla yapı yapılamaz. Müştemilat binaları inşaat alanına dahildir. 1.5.17.1.12 Dünya Bankası, Avrupa Birliği Fonları, Tarım ve Kırsal Kalkınmayı Destekleme Kurumu ve Gıda, Tarım ve Hayvancılık Bakanlığı tarafından desteklenen tarımsal ve hayvancılık amaçlı projeler... ile hastalıktan ari işletme sertifikasına sahip işletmelerin yatırımlarında ve işletme projesi olup İl/İlçe Tarım ve Orman Müdürlüğüne, hastalıktan ari işletme sertifikası için dilekçe ile birlikte arilik sertifikası alacağına dair taahhütname veren yeni işletme yatırımlarında yapılaşma emsali %50 oranında artırılabilir. Ancak fiilen sulanan ve/veya sulama projesi kapsamında kalan tarım arazilerinde bu hüküm uygulanmaz. Tarımsal amaçlı yapılar amacı dışında kullanılamaz ve başka bir kullanıma dönüştürülemez. 1.5.17.1.13 Tarım arazilerinde örtü altı tarım yapılması durumunda seralar emsale dâhil değildir.",
Çorum,samsun,Örtü Altı Tarım (Seralar);Özel Ürün Arazileri,,,,,,,,,,,webimar-nextjs/data/100binlik/çorum-samsun-tokat.txt,,"1.5.17.1.15 Tarımsal faaliyetin gerektirdiği (hayvancılık, seracılık..vb.) çiftçinin barınabileceği yapı haricinde tarımsal faaliyetten bağımsız barınma amaçlı yapı yapılamaz. 1.5.17.1.13 Tarım arazilerinde örtü altı tarım yapılması durumunda seralar emsale dâhil değildir. 1.5.17.1.14 Bu planda tarım arazisi olarak gösterilmiş alanlarda mera vasıflı alanlar bulunması durumunda, bu alanlarda “Yayla ve Mera Alanları”na ilişkin plan hükümleri doğrultusunda uygulama yapılır. 1.5.17.1.15 Tarımsal faaliyetin gerektirdiği (hayvancılık, seracılık..vb.) çiftçinin barınabileceği yapı haricinde tarımsal faaliyetten bağımsız barınma amaçlı yapı yapılamaz. 1.5.17.1.16 Silo, samanlık, yem deposu vb. yapıların yükseklikleri (hmax) ihtiyaç doğrultusunda İl Gıda, Tarım ve Hayvancılık İl Müdürlüğü’nün uygun görüşü alınarak belirlenir 1.5.17.1.17 Gıda, Tarım ve Hayvancılık Bakanlığınca ova sınırlarının tespit edilmesinin ardından ova sınırları içerisinde kaldığı tespit edilen alanlarda “1.5.17.1.11.2 Özel Ürün Arazileri”ne ilişkin plan notunda yer alan hükümler uygulanacaktır. Bu alanlarda tarım ve hayvancılık geliştirme alanları yapılamaz.",
Çorum,samsun,Özel Ürün Arazileri,,,,,,,,,,,webimar-nextjs/data/100binlik/çorum-samsun-tokat.txt,,"1.5.17.1.16 Silo, samanlık, yem deposu vb. yapıların yükseklikleri (hmax) ihtiyaç doğrultusunda İl Gıda, Tarım ve Hayvancılık İl Müdürlüğü’nün uygun görüşü alınarak belirlenir 1.5.17.1.14 Bu planda tarım arazisi olarak gösterilmiş alanlarda mera vasıflı alanlar bulunması durumunda, bu alanlarda “Yayla ve Mera Alanları”na ilişkin plan hükümleri doğrultusunda uygulama yapılır. 1.5.17.1.15 Tarımsal faaliyetin gerektirdiği (hayvancılık, seracılık..vb.) çiftçinin barınabileceği yapı haricinde tarımsal faaliyetten bağımsız barınma amaçlı yapı yapılamaz. 1.5.17.1.16 Silo, samanlık, yem deposu vb. yapıların yükseklikleri (hmax) ihtiyaç doğrultusunda İl Gıda, Tarım ve Hayvancılık İl Müdürlüğü’nün uygun görüşü alınarak belirlenir 1.5.17.1.17 Gıda, Tarım ve Hayvancılık Bakanlığınca ova sınırlarının tespit edilmesinin ardından ova sınırları içerisinde kaldığı tespit edilen alanlarda “1.5.17.1.11.2 Özel Ürün Arazileri”ne ilişkin plan notunda yer alan hükümler uygulanacaktır. Bu alanlarda tarım ve hayvancılık geliştirme alanları yapılamaz.",
Çorum,samsun,Sulama Alanları;Özel Ürün Arazileri,,,,,,,,,,,webimar-nextjs/data/100binlik/çorum-samsun-tokat.txt,,"1.5.17.1.17 Gıda, Tarım ve Hayvancılık Bakanlığınca ova sınırlarının tespit edilmesinin ardından ova sınırları içerisinde kaldığı tespit edilen alanlarda “1.5.17.1.11.2 Özel Ürün Arazileri”ne ilişkin plan notunda yer alan hükümler uygulanacaktır. Bu alanlarda tarım ve hayvancılık geliştirme alanları yapılamaz. 1.5.17.1.15 Tarımsal faaliyetin gerektirdiği (hayvancılık, seracılık..vb.) çiftçinin barınabileceği yapı haricinde tarımsal faaliyetten bağımsız barınma amaçlı yapı yapılamaz. 1.5.17.1.16 Silo, samanlık, yem deposu vb. yapıların yükseklikleri (hmax) ihtiyaç doğrultusunda İl Gıda, Tarım ve Hayvancılık İl Müdürlüğü’nün uygun görüşü alınarak belirlenir 1.5.17.1.17 Gıda, Tarım ve Hayvancılık Bakanlığınca ova sınırlarının tespit edilmesinin ardından ova sınırları içerisinde kaldığı tespit edilen alanlarda “1.5.17.1.11.2 Özel Ürün Arazileri”ne ilişkin plan notunda yer alan hükümler uygulanacaktır. Bu alanlarda tarım ve hayvancılık geliştirme alanları yapılamaz.  1.5.17.2 TARIM ARAZİLERİ (3083 SAYILI SULAMA ALANLARINDA ARAZİ DÜZENLEMESİNE DAİR TARIM REFORMU KANUNUNA TABİ ARAZİLER).",
Çorum,samsun,Sulama Alanları,,,,,,,,,,,webimar-nextjs/data/100binlik/çorum-samsun-tokat.txt,,"1.5.17.2.3 Bu arazilerin tarımsal üretim amaçlı korunması esastır. Uygulama alanlarında, imar planları ve mücavir alanlar dışında kalan ve “Sulama Alanlarında Arazi Düzenlenmesine Dair Tarım Reformu Kanunu Uygulama Yönetmeliği” hükümlerine göre, sahibine bırakılan, dağıtılan veya T.C. Tarım, Gıda Ve Hayvancılık Bakanlığı’nın tasarrufunda bulunan tarım arazisi, tarım dışı amaçla kullanılamaz. 1.5.17.2.1 Bu arazilerde, ilgili kanun kapsamında yapılan/yapılacak uygulamalarda bu plan kararlarına uyulacaktır. 1.5.17.2.2 Yapılacak ifrazlarda 3083 sayılı Sulama Alanlarında Arazi Düzenlemesine Dair Tarım Reformu Kanunu ve ilgili yönetmelik hükümleri uyarınca işlem yapılacaktır. 1.5.17.2.3 Bu arazilerin tarımsal üretim amaçlı korunması esastır. Uygulama alanlarında, imar planları ve mücavir alanlar dışında kalan ve “Sulama Alanlarında Arazi Düzenlenmesine Dair Tarım Reformu Kanunu Uygulama Yönetmeliği” hükümlerine göre, sahibine bırakılan, dağıtılan veya T.C. Tarım, Gıda Ve Hayvancılık Bakanlığı’nın tasarrufunda bulunan tarım arazisi, tarım dışı amaçla kullanılamaz. 1.5.17.2.4 Tarımsal faaliyetin gerektirdiği (hayvancılık, seracılık..vb.) çiftçinin barınabileceği yapı haricinde tarımsal faaliyetten bağımsız barınma amaçlı yapı yapılamaz. 1.5.17.2.5 Bu arazilerde; tarımsal amaçlı yapılar yapılabilir. Çiftçinin barınabileceği yapı emsale dahil olup inşaat alanı 100 m2’yi geçemez. Tarımsal amaçlı yapılar için maks. Emsal = 0,20’dir",
Çorum,samsun,Koruma/Koruma Alanları;Sulama Alanları,,,,,,,,,,,webimar-nextjs/data/100binlik/çorum-samsun-tokat.txt,,"1.5.17.2.4 Tarımsal faaliyetin gerektirdiği (hayvancılık, seracılık..vb.) çiftçinin barınabileceği yapı haricinde tarımsal faaliyetten bağımsız barınma amaçlı yapı yapılamaz. 1.5.17.2.2 Yapılacak ifrazlarda 3083 sayılı Sulama Alanlarında Arazi Düzenlemesine Dair Tarım Reformu Kanunu ve ilgili yönetmelik hükümleri uyarınca işlem yapılacaktır. 1.5.17.2.3 Bu arazilerin tarımsal üretim amaçlı korunması esastır. Uygulama alanlarında, imar planları ve mücavir alanlar dışında kalan ve “Sulama Alanlarında Arazi Düzenlenmesine Dair Tarım Reformu Kanunu Uygulama Yönetmeliği” hükümlerine göre, sahibine bırakılan, dağıtılan veya T.C. Tarım, Gıda Ve Hayvancılık Bakanlığı’nın tasarrufunda bulunan tarım arazisi, tarım dışı amaçla kullanılamaz. 1.5.17.2.4 Tarımsal faaliyetin gerektirdiği (hayvancılık, seracılık..vb.) çiftçinin barınabileceği yapı haricinde tarımsal faaliyetten bağımsız barınma amaçlı yapı yapılamaz. 1.5.17.2.5 Bu arazilerde; tarımsal amaçlı yapılar yapılabilir. Çiftçinin barınabileceği yapı emsale dahil olup inşaat alanı 100 m2’yi geçemez. Tarımsal amaçlı yapılar için maks. Emsal = 0,20’dir 1.5.17.2.6 5403 sayılı Toprak Koruma ve Arazi Kullanımı Kanununda tanımlanan tarım arazilerinden fiilen sulanan veya sulama projesi kapsamında kalan tarım arazilerinde; bu planın, “1.5.13. Tarım ve Hayvancılık Geliştirme Alanları” hükmü çerçevesinde ilgili idarelerce yapılacak olan uygulamalar haricinde öncelikle Tarım, Gıda ve Hayvancılık Bakanlığı ile Orman ve Su İşleri Bakanlığı’ndan ve ilgili diğer kurum ve kuruluşlardan uygun görüş alınması kaydıyla tarımsal amaçlı olduğu ilgili idaresince kabul edilen hayvancılık tesisleri yer alabilecek olup bu tesisler sonradan entegre tesise dönüştürülemez.",
Çorum,samsun,Koruma/Koruma Alanları;Sulama Alanları,,,,,,,,,,,webimar-nextjs/data/100binlik/çorum-samsun-tokat.txt,,"1.5.17.2.6 5403 sayılı Toprak Koruma ve Arazi Kullanımı Kanununda tanımlanan tarım arazilerinden fiilen sulanan veya sulama projesi kapsamında kalan tarım arazilerinde; bu planın, “1.5.13. Tarım ve Hayvancılık Geliştirme Alanları” hükmü çerçevesinde ilgili idarelerce yapılacak olan uygulamalar haricinde öncelikle Tarım, Gıda ve Hayvancılık Bakanlığı ile Orman ve Su İşleri Bakanlığı’ndan ve ilgili diğer kurum ve kuruluşlardan uygun görüş alınması kaydıyla tarımsal amaçlı olduğu ilgili idaresince kabul edilen hayvancılık tesisleri yer alabilecek olup bu tesisler sonradan entegre tesise dönüştürülemez. 1.5.17.2.4 Tarımsal faaliyetin gerektirdiği (hayvancılık, seracılık..vb.) çiftçinin barınabileceği yapı haricinde tarımsal faaliyetten bağımsız barınma amaçlı yapı yapılamaz. 1.5.17.2.5 Bu arazilerde; tarımsal amaçlı yapılar yapılabilir. Çiftçinin barınabileceği yapı emsale dahil olup inşaat alanı 100 m2’yi geçemez. Tarımsal amaçlı yapılar için maks. Emsal = 0,20’dir 1.5.17.2.6 5403 sayılı Toprak Koruma ve Arazi Kullanımı Kanununda tanımlanan tarım arazilerinden fiilen sulanan veya sulama projesi kapsamında kalan tarım arazilerinde; bu planın, “1.5.13. Tarım ve Hayvancılık Geliştirme Alanları” hükmü çerçevesinde ilgili idarelerce yapılacak olan uygulamalar haricinde öncelikle Tarım, Gıda ve Hayvancılık Bakanlığı ile Orman ve Su İşleri Bakanlığı’ndan ve ilgili diğer kurum ve kuruluşlardan uygun görüş alınması kaydıyla tarımsal amaçlı olduğu ilgili idaresince kabul edilen hayvancılık tesisleri yer alabilecek olup bu tesisler sonradan entegre tesise dönüştürülemez. 1.5.17.2.7 3083 sayılı Sulama Alanlarında Arazi Düzenlemesine Dair Tarım Reformu Kanunu kapsamı dışına çıkarılması durumunda, bu arazilerde “1.5.17.1 Tarım Arazileri (5403 Sayılı Toprak Koruma ve Arazi Kullanımı Kanununa Tabi Araziler)” başlığı altında yer alan plan hükümlerine uyulacaktır. 1.5.17.2.8 Bu arazilerde 5403 Sayılı Toprak Koruma ve Arazi Kullanımı Kanununa Tabi Arazilere ilişkin 1.5.17.1.12 numaralı plan hükmü uygulanamaz.",
Çorum,samsun,Koruma/Koruma Alanları;Sulama Alanları;Özel Ürün Arazileri,,,,,,,,,,,webimar-nextjs/data/100binlik/çorum-samsun-tokat.txt,,"1.5.17.2.9 Silo, samanlık, yem deposu vb. yapıların yükseklikleri (hmax) ihtiyaç doğrultusunda İl Gıda, Tarım ve Hayvancılık İl Müdürlüğü’nün uygun görüşü alınarak belirlenir 1.5.17.2.7 3083 sayılı Sulama Alanlarında Arazi Düzenlemesine Dair Tarım Reformu Kanunu kapsamı dışına çıkarılması durumunda, bu arazilerde “1.5.17.1 Tarım Arazileri (5403 Sayılı Toprak Koruma ve Arazi Kullanımı Kanununa Tabi Araziler)” başlığı altında yer alan plan hükümlerine uyulacaktır. 1.5.17.2.8 Bu arazilerde 5403 Sayılı Toprak Koruma ve Arazi Kullanımı Kanununa Tabi Arazilere ilişkin 1.5.17.1.12 numaralı plan hükmü uygulanamaz. 1.5.17.2.9 Silo, samanlık, yem deposu vb. yapıların yükseklikleri (hmax) ihtiyaç doğrultusunda İl Gıda, Tarım ve Hayvancılık İl Müdürlüğü’nün uygun görüşü alınarak belirlenir 1.5.17.2.10 Gıda, Tarım ve Hayvancılık Bakanlığınca ova sınırlarının tespit edilmesinin ardından ova sınırları içerisinde kaldığı tespit edilen alanlarda “1.5.17.1.11.2 Özel Ürün Arazileri” maddesinde yer alan hükümler uygulanacaktır. Bu alanlarda tarım ve hayvancılık geliştirme alanları yapılamaz.",
